{
  "schema_version": "xir-lab-execution-profile-v1",
  "profile_id": "pilot-template-v1",
  "profile_version": 1,
  "profile_mode": "template",
  "profile_kind": "pilot",
  "approval_operation_type": "pilot",
  "fixed_seed": "9cbb4e30a4f18fe9311a9b6005a19f158cc252960779836595bf7a42ea3a8d15",
  "conditions": ["HH", "HL", "LH", "LL"],
  "counts": {
    "pair_slots_per_condition": 5,
    "planned_pair_slots": 20,
    "designated_attempt_kind": "pilot",
    "planned_designated_attempts": 40,
    "warmups_per_condition_arm": 0,
    "planned_warmup_attempts": 0,
    "planned_total_non_retry_attempts": 40,
    "retry_attempts_in_designated_count": false
  },
  "live_limits": {
    "max_retries_per_lineage": null,
    "max_batch_attempts": null,
    "max_duration_seconds": null,
    "max_in_flight_attempts": null,
    "chain_budget_wei": {
      "11155420": null,
      "421614": null,
      "84532": null
    },
    "stop_policy": null,
    "allow_partial_conditions": null
  },
  "derived_from": {
    "kind": "none",
    "run_id": null,
    "freeze_sha256": null,
    "reconciled": null
  }
}
